{
  "format_version": "1.0",
  "fixture_kind": "synthetic",
  "asset_reference": "SYNTH-ASSET-001",
  "collection_mode": "synthetic-fixture",
  "os": {
    "product_family": "Windows",
    "version": "10.0",
    "build": "22631"
  },
  "defender": {
    "antivirus": "enabled",
    "real_time_protection": "enabled",
    "service": "enabled"
  },
  "bitlocker": {
    "system_volume_protection": "enabled",
    "protected_volume_count": 1
  },
  "firewall": {
    "domain": "enabled",
    "private": "enabled",
    "public": "enabled"
  },
  "updates": {
    "latest_install_date": "2026-01-15",
    "currentness": "not-determined"
  }
}
